{
  "$schema": "http://json-schema.org/draft-07/schema#",
  "$id": "https://github.com/LegendaryMediaTV/EGP-Graphai/bible-versions/bible-verses-schema.json",
  "title": "EGP Graphai • Bible Verses",
  "description": "Schema for individual verse records with formatted content, footnotes, and lexical metadata.",
  "type": "object",
  "additionalProperties": false,
  "required": ["book", "chapter", "verse", "content"],
  "properties": {
    "book": {
      "$ref": "https://github.com/LegendaryMediaTV/EGP-Graphai/bible-books/bible-books-schema.json#/definitions/book/properties/_id",
      "description": "Book identifier matching _id in bible-books.json (e.g., 'John')"
    },
    "chapter": {
      "type": "integer",
      "minimum": 1,
      "description": "Chapter number"
    },
    "verse": { "type": "integer", "minimum": 1, "description": "Verse number" },
    "content": {
      "$ref": "https://github.com/LegendaryMediaTV/EGP-Graphai/content-schema.json",
      "description": "Verse content using the flexible content-schema structure (string, object, or array)."
    }
  }
}
