[
  {
    "book": "Jude",
    "chapter": 1,
    "verse": 1,
    "content": [
      {
        "type": "p"
      },
      {
        "text": "Jude,",
        "foot": {
          "type": "trn",
          "content": [
            {
              "text": "or, Judah"
            }
          ]
        }
      },
      {
        "text": "a servant of Jesus Christ,",
        "foot": {
          "type": "stu",
          "content": [
            {
              "text": "“Christ” means “Anointed One”."
            }
          ]
        }
      },
      {
        "text": "and brother of James, to those who are called, sanctified by God the Father, and kept for Jesus Christ:"
      }
    ]
  },
  {
    "book": "Jude",
    "chapter": 1,
    "verse": 2,
    "content": [
      {
        "text": "May mercy, peace, and love be multiplied to you."
      }
    ]
  },
  {
    "book": "Jude",
    "chapter": 1,
    "verse": 3,
    "content": [
      {
        "type": "p"
      },
      {
        "text": "Beloved, while I was very eager to write to you about our common salvation, I was constrained to write to you exhorting you to contend earnestly for the faith which was once for all delivered to the saints."
      }
    ]
  },
  {
    "book": "Jude",
    "chapter": 1,
    "verse": 4,
    "content": [
      {
        "text": "For there are certain men who crept in secretly, even those who were long ago written about for this condemnation: ungodly men, turning the grace of our God into indecency, and denying our only Master, God, and Lord, Jesus Christ."
      }
    ]
  },
  {
    "book": "Jude",
    "chapter": 1,
    "verse": 5,
    "content": [
      {
        "type": "p"
      },
      {
        "text": "Now I desire to remind you, though you already know this, that the Lord, having saved a people out of the land of Egypt, afterward destroyed those who didn’t believe."
      }
    ]
  },
  {
    "book": "Jude",
    "chapter": 1,
    "verse": 6,
    "content": [
      {
        "text": "Angels who didn’t keep their first domain, but deserted their own dwelling place, he has kept in everlasting bonds under darkness for the judgment of the great day."
      }
    ]
  },
  {
    "book": "Jude",
    "chapter": 1,
    "verse": 7,
    "content": [
      {
        "text": "Even as Sodom and Gomorrah and the cities around them, having in the same way as these given themselves over to sexual immorality and gone after strange flesh, are shown as an example, suffering the punishment of eternal fire."
      }
    ]
  },
  {
    "book": "Jude",
    "chapter": 1,
    "verse": 8,
    "content": [
      {
        "text": "Yet in the same way, these also in their dreaming defile the flesh, despise authority, and slander celestial beings."
      }
    ]
  },
  {
    "book": "Jude",
    "chapter": 1,
    "verse": 9,
    "content": [
      {
        "text": "But Michael, the archangel, when contending with the devil and arguing about the body of Moses, dared not bring against him an abusive condemnation, but said, “May the Lord rebuke you!”"
      }
    ]
  },
  {
    "book": "Jude",
    "chapter": 1,
    "verse": 10,
    "content": [
      {
        "text": "But these speak evil of whatever things they don’t know. They are destroyed in these things that they understand naturally, like the creatures without reason."
      }
    ]
  },
  {
    "book": "Jude",
    "chapter": 1,
    "verse": 11,
    "content": [
      {
        "text": "Woe to them! For they went in the way of Cain, and ran riotously in the error of Balaam for hire, and perished in Korah’s rebellion."
      }
    ]
  },
  {
    "book": "Jude",
    "chapter": 1,
    "verse": 12,
    "content": [
      {
        "text": "These are hidden rocky reefs in your love feasts when they feast with you, shepherds who without fear feed themselves; clouds without water, carried along by winds; autumn trees without fruit, twice dead, plucked up by the roots;"
      }
    ]
  },
  {
    "book": "Jude",
    "chapter": 1,
    "verse": 13,
    "content": [
      {
        "text": "wild waves of the sea, foaming out their own shame; wandering stars, for whom the blackness of darkness has been reserved forever."
      }
    ]
  },
  {
    "book": "Jude",
    "chapter": 1,
    "verse": 14,
    "content": [
      {
        "text": "About these also Enoch, the seventh from Adam, prophesied, saying, “Behold,",
        "foot": {
          "type": "trn",
          "content": [
            {
              "text": "“Behold”, from “"
            },
            {
              "text": "ἰδοὺ",
              "script": "G"
            },
            {
              "text": "”, means look at, take notice, observe, see, or gaze at. It is often used as an interjection."
            }
          ]
        }
      },
      {
        "text": "the Lord came with ten thousands of his holy ones,"
      }
    ]
  },
  {
    "book": "Jude",
    "chapter": 1,
    "verse": 15,
    "content": [
      {
        "text": "to execute judgment on all, and to convict all the ungodly of all their works of ungodliness which they have done in an ungodly way, and of all the hard things which ungodly sinners have spoken against him.”"
      }
    ]
  },
  {
    "book": "Jude",
    "chapter": 1,
    "verse": 16,
    "content": [
      {
        "text": "These are murmurers and complainers, walking after their lusts—and their mouth speaks proud things—showing respect of persons to gain advantage."
      }
    ]
  },
  {
    "book": "Jude",
    "chapter": 1,
    "verse": 17,
    "content": [
      {
        "type": "p"
      },
      {
        "text": "But you, beloved, remember the words which have been spoken before by the apostles of our Lord Jesus Christ."
      }
    ]
  },
  {
    "book": "Jude",
    "chapter": 1,
    "verse": 18,
    "content": [
      {
        "text": "They said to you, “In the last time there will be mockers, walking after their own ungodly lusts.”"
      }
    ]
  },
  {
    "book": "Jude",
    "chapter": 1,
    "verse": 19,
    "content": [
      {
        "text": "These are those who cause divisions and are sensual, not having the Spirit."
      }
    ]
  },
  {
    "book": "Jude",
    "chapter": 1,
    "verse": 20,
    "content": [
      {
        "type": "p"
      },
      {
        "text": "But you, beloved, keep building up yourselves on your most holy faith, praying in the Holy Spirit."
      }
    ]
  },
  {
    "book": "Jude",
    "chapter": 1,
    "verse": 21,
    "content": [
      {
        "text": "Keep yourselves in God’s love, looking for the mercy of our Lord Jesus Christ to eternal life."
      }
    ]
  },
  {
    "book": "Jude",
    "chapter": 1,
    "verse": 22,
    "content": [
      {
        "text": "On some have compassion, making a distinction,"
      }
    ]
  },
  {
    "book": "Jude",
    "chapter": 1,
    "verse": 23,
    "content": [
      {
        "text": "and some save, snatching them out of the fire with fear, hating even the clothing stained by the flesh."
      }
    ]
  },
  {
    "book": "Jude",
    "chapter": 1,
    "verse": 24,
    "content": [
      {
        "type": "p"
      },
      {
        "text": "Now to him who is able to keep them",
        "foot": {
          "type": "stu",
          "content": [
            {
              "text": "TR and NU read “you”"
            }
          ]
        }
      },
      {
        "text": "from stumbling, and to present you faultless before the presence of his glory in great joy,"
      }
    ]
  },
  {
    "book": "Jude",
    "chapter": 1,
    "verse": 25,
    "content": [
      {
        "text": "to God our Savior, who alone is wise, be glory and majesty, dominion and power, both now and forever. Amen."
      }
    ]
  }
]