[
  {
    "book": "2John",
    "chapter": 1,
    "verse": 1,
    "content": [
      {
        "type": "p"
      },
      {
        "text": "The elder unto the elect lady and her children, whom I love in truth; and not I only, but also all they that know the truth;"
      }
    ]
  },
  {
    "book": "2John",
    "chapter": 1,
    "verse": 2,
    "content": [
      {
        "text": "for the truthâ€™s sake which abideth in us, and it shall be with us for ever:"
      }
    ]
  },
  {
    "book": "2John",
    "chapter": 1,
    "verse": 3,
    "content": [
      {
        "text": "Grace, mercy, peace shall be with us, from God the Father, and from Jesus Christ, the Son of the Father, in truth and love."
      }
    ]
  },
  {
    "book": "2John",
    "chapter": 1,
    "verse": 4,
    "content": [
      {
        "text": "I rejoice greatly that I have found certain of thy children walking in truth, even as we received commandment from the Father."
      }
    ]
  },
  {
    "book": "2John",
    "chapter": 1,
    "verse": 5,
    "content": [
      {
        "text": "And now I beseech thee, lady, not as though I wrote to thee a new commandment, but that which we had from the beginning, that we love one another."
      }
    ]
  },
  {
    "book": "2John",
    "chapter": 1,
    "verse": 6,
    "content": [
      {
        "text": "And this is love, that we should walk after his commandments. This is the commandment, even as ye heard from the beginning, that ye should walk in it."
      }
    ]
  },
  {
    "book": "2John",
    "chapter": 1,
    "verse": 7,
    "content": [
      {
        "text": "For many deceivers are gone forth into the world, even they that confess not that Jesus Christ cometh in the flesh. This is the deceiver and the antichrist."
      }
    ]
  },
  {
    "book": "2John",
    "chapter": 1,
    "verse": 8,
    "content": [
      {
        "text": "Look to yourselves, that ye lose not the things which we have wrought, but that ye receive a full reward."
      }
    ]
  },
  {
    "book": "2John",
    "chapter": 1,
    "verse": 9,
    "content": [
      {
        "text": "Whosoever goeth onward and abideth not in the teaching of Christ, hath not God: he that abideth in the teaching, the same hath both the Father and the Son."
      }
    ]
  },
  {
    "book": "2John",
    "chapter": 1,
    "verse": 10,
    "content": [
      {
        "text": "If any one cometh unto you, and bringeth not this teaching, receive him not into your house, and give him no greeting:"
      }
    ]
  },
  {
    "book": "2John",
    "chapter": 1,
    "verse": 11,
    "content": [
      {
        "text": "for he that giveth him greeting partaketh in his evil works."
      }
    ]
  },
  {
    "book": "2John",
    "chapter": 1,
    "verse": 12,
    "content": [
      {
        "text": "Having many things to write unto you, I would not write them with paper and ink: but I hope to come unto you, and to speak face to face, that your joy may be made full."
      }
    ]
  },
  {
    "book": "2John",
    "chapter": 1,
    "verse": 13,
    "content": [
      {
        "text": "The children of thine elect sister salute thee."
      }
    ]
  }
]