[
  {
    "book": "PMA",
    "chapter": 1,
    "verse": 1,
    "content": [
      {
        "foot": {
          "type": "var",
          "content": [
            { "text": "The Prayer of Manasses", "marks": ["i"] },
            " is recognized as Deuterocanonical Scripture by the Greek Orthodox and Russian Orthodox Churches. It is included in an appendix to the Latin Vulgate Bible."
          ]
        }
      },
      { "paragraph": true },
      "O ",
      { "text": "Lord", "marks": ["sc"] },
      " Almighty in heaven, God of our fathers Abraham, Isaac, and Jacob, and of their righteous offspring,"
    ]
  },
  {
    "book": "PMA",
    "chapter": 1,
    "verse": 2,
    "content": "you who have made heaven and earth, with all their order,"
  },
  {
    "book": "PMA",
    "chapter": 1,
    "verse": 3,
    "content": "who have bound the sea by the word of your commandment, who have shut up the deep, and sealed it by your terrible and glorious name,"
  },
  {
    "book": "PMA",
    "chapter": 1,
    "verse": 4,
    "content": "whom all things fear, yes, tremble before your power,"
  },
  {
    "book": "PMA",
    "chapter": 1,
    "verse": 5,
    "content": "for the majesty of your glory can’t be borne, and the anger of your threatening toward sinners is unbearable."
  },
  {
    "book": "PMA",
    "chapter": 1,
    "verse": 6,
    "content": "Your merciful promise is unmeasurable and unsearchable,"
  },
  {
    "book": "PMA",
    "chapter": 1,
    "verse": 7,
    "content": "for you are the Lord Most High, of great compassion, patient and abundant in mercy, and relent at human suffering."
  },
  {
    "book": "PMA",
    "chapter": 1,
    "verse": 8,
    "content": [
      {
        "foot": {
          "type": "stu",
          "content": [
            "The Alex. MS. omits ",
            { "text": "You... saved.", "marks": ["i"] }
          ]
        }
      },
      "You, O Lord, according to your great goodness have promised repentance and forgiveness to those who have sinned against you. Of your infinite mercies, you have appointed repentance to sinners, that they may be saved. You therefore, O Lord, who are the God of the just, have not appointed repentance to the just, to Abraham, Isaac, and Jacob, which have not sinned against you, but you have appointed repentance to me, a sinner."
    ]
  },
  {
    "book": "PMA",
    "chapter": 1,
    "verse": 9,
    "content": [
      {
        "text": "For I have sinned more than the number of the sands of the sea. My transgressions are multiplied,",
        "foot": {
          "type": "stu",
          "content": [
            "The Alex. MS. omits ",
            { "text": "O Lord... multiplied.", "marks": ["i"] }
          ]
        }
      },
      " O Lord, my transgressions are multiplied, and I am not worthy to behold and see the height of heaven for the multitude of my iniquities."
    ]
  },
  {
    "book": "PMA",
    "chapter": 1,
    "verse": 10,
    "content": [
      {
        "text": "I am bowed down with many iron bands, so that I can’t lift up my head by reason of my sins,",
        "foot": {
          "type": "stu",
          "content": [
            "Some authorities omit ",
            { "text": "by reason of my sins.", "marks": ["i"] }
          ]
        }
      },
      {
        "text": " neither have I any relief; for I have provoked your wrath, and done that which is evil before you:",
        "foot": {
          "type": "stu",
          "content": [
            "The Alex. MS. omits ",
            { "text": "I did... commandments.", "marks": ["i"] }
          ]
        }
      },
      " I didn’t do your will, neither did I keep your commandments. I have set up abominations, and have multiplied detestable things."
    ]
  },
  {
    "book": "PMA",
    "chapter": 1,
    "verse": 11,
    "content": "Now therefore I bow the knee of my heart, asking you for grace."
  },
  {
    "book": "PMA",
    "chapter": 1,
    "verse": 12,
    "content": "I have sinned, O Lord, I have sinned, and I acknowledge my iniquities;"
  },
  {
    "book": "PMA",
    "chapter": 1,
    "verse": 13,
    "content": "but, I humbly ask you, forgive me, O Lord, forgive me, and please don’t destroy me with my iniquities. Don’t be angry with me forever, by reserving evil for me. Don’t condemn me into the lower parts of the earth. For you, O Lord, are the God of those who repent."
  },
  {
    "book": "PMA",
    "chapter": 1,
    "verse": 14,
    "content": "In me you will show all your goodness, for you will save me, even though I am unworthy, according to your great mercy."
  },
  {
    "book": "PMA",
    "chapter": 1,
    "verse": 15,
    "content": "Then I will praise you forever all the days of my life; for all the army of heaven sings your praise, and yours is the glory forever and ever. Amen."
  }
]
