[
  {
    "book": "TIT",
    "chapter": 1,
    "verse": 1,
    "content": [
      {
        "paragraph": true,
        "text": "Paul, a servant of God and an apostle of Jesus Christ,",
        "foot": { "type": "stu", "content": "“Christ” means “Anointed One”." }
      },
      " according to the faith of God’s chosen ones and the knowledge of the truth which is according to godliness,"
    ]
  },
  {
    "book": "TIT",
    "chapter": 1,
    "verse": 2,
    "content": "in hope of eternal life, which God, who can’t lie, promised before time began;"
  },
  {
    "book": "TIT",
    "chapter": 1,
    "verse": 3,
    "content": "but in his own time revealed his word in the message with which I was entrusted according to the commandment of God our Savior,"
  },
  {
    "book": "TIT",
    "chapter": 1,
    "verse": 4,
    "content": "to Titus, my true child according to a common faith: Grace, mercy, and peace from God the Father and the Lord Jesus Christ our Savior."
  },
  {
    "book": "TIT",
    "chapter": 1,
    "verse": 5,
    "content": {
      "paragraph": true,
      "text": "I left you in Crete for this reason, that you would set in order the things that were lacking and appoint elders in every city, as I directed you—"
    }
  },
  {
    "book": "TIT",
    "chapter": 1,
    "verse": 6,
    "content": "if anyone is blameless, the husband of one wife, having children who believe, who are not accused of loose or unruly behavior."
  },
  {
    "book": "TIT",
    "chapter": 1,
    "verse": 7,
    "content": "For the overseer must be blameless, as God’s steward, not self-pleasing, not easily angered, not given to wine, not violent, not greedy for dishonest gain;"
  },
  {
    "book": "TIT",
    "chapter": 1,
    "verse": 8,
    "content": "but given to hospitality, a lover of good, sober minded, fair, holy, self-controlled,"
  },
  {
    "book": "TIT",
    "chapter": 1,
    "verse": 9,
    "content": "holding to the faithful word which is according to the teaching, that he may be able to exhort in the sound doctrine, and to convict those who contradict him."
  },
  {
    "book": "TIT",
    "chapter": 1,
    "verse": 10,
    "content": {
      "paragraph": true,
      "text": "For there are also many unruly men, vain talkers and deceivers, especially those of the circumcision,"
    }
  },
  {
    "book": "TIT",
    "chapter": 1,
    "verse": 11,
    "content": "whose mouths must be stopped: men who overthrow whole houses, teaching things which they ought not, for dishonest gain’s sake."
  },
  {
    "book": "TIT",
    "chapter": 1,
    "verse": 12,
    "content": "One of them, a prophet of their own, said, “Cretans are always liars, evil beasts, and idle gluttons.”"
  },
  {
    "book": "TIT",
    "chapter": 1,
    "verse": 13,
    "content": "This testimony is true. For this cause, reprove them sharply, that they may be sound in the faith,"
  },
  {
    "book": "TIT",
    "chapter": 1,
    "verse": 14,
    "content": "not paying attention to Jewish fables and commandments of men who turn away from the truth."
  },
  {
    "book": "TIT",
    "chapter": 1,
    "verse": 15,
    "content": "To the pure, all things are pure, but to those who are defiled and unbelieving, nothing is pure; but both their mind and their conscience are defiled."
  },
  {
    "book": "TIT",
    "chapter": 1,
    "verse": 16,
    "content": "They profess that they know God, but by their deeds they deny him, being abominable, disobedient, and unfit for any good work."
  },
  {
    "book": "TIT",
    "chapter": 2,
    "verse": 1,
    "content": {
      "paragraph": true,
      "text": "But say the things which fit sound doctrine,"
    }
  },
  {
    "book": "TIT",
    "chapter": 2,
    "verse": 2,
    "content": "that older men should be temperate, sensible, sober minded, sound in faith, in love, and in perseverance,"
  },
  {
    "book": "TIT",
    "chapter": 2,
    "verse": 3,
    "content": "and that older women likewise be reverent in behavior, not slanderers nor enslaved to much wine, teachers of that which is good,"
  },
  {
    "book": "TIT",
    "chapter": 2,
    "verse": 4,
    "content": "that they may train the young wives to love their husbands, to love their children,"
  },
  {
    "book": "TIT",
    "chapter": 2,
    "verse": 5,
    "content": "to be sober minded, chaste, workers at home, kind, being in subjection to their own husbands, that God’s word may not be blasphemed."
  },
  {
    "book": "TIT",
    "chapter": 2,
    "verse": 6,
    "content": {
      "paragraph": true,
      "text": "Likewise, exhort the younger men to be sober minded."
    }
  },
  {
    "book": "TIT",
    "chapter": 2,
    "verse": 7,
    "content": "In all things show yourself an example of good works. In your teaching, show integrity, seriousness, incorruptibility,"
  },
  {
    "book": "TIT",
    "chapter": 2,
    "verse": 8,
    "content": "and soundness of speech that can’t be condemned, that he who opposes you may be ashamed, having no evil thing to say about us."
  },
  {
    "book": "TIT",
    "chapter": 2,
    "verse": 9,
    "content": {
      "paragraph": true,
      "text": "Exhort servants to be in subjection to their own masters and to be well-pleasing in all things, not contradicting,"
    }
  },
  {
    "book": "TIT",
    "chapter": 2,
    "verse": 10,
    "content": "not stealing, but showing all good fidelity, that they may adorn the doctrine of God, our Savior, in all things."
  },
  {
    "book": "TIT",
    "chapter": 2,
    "verse": 11,
    "content": "For the grace of God has appeared, bringing salvation to all men,"
  },
  {
    "book": "TIT",
    "chapter": 2,
    "verse": 12,
    "content": "instructing us to the intent that, denying ungodliness and worldly lusts, we would live soberly, righteously, and godly in this present age;"
  },
  {
    "book": "TIT",
    "chapter": 2,
    "verse": 13,
    "content": "looking for the blessed hope and appearing of the glory of our great God and Savior, Jesus Christ,"
  },
  {
    "book": "TIT",
    "chapter": 2,
    "verse": 14,
    "content": "who gave himself for us, that he might redeem us from all iniquity and purify for himself a people for his own possession, zealous for good works."
  },
  {
    "book": "TIT",
    "chapter": 2,
    "verse": 15,
    "content": {
      "paragraph": true,
      "text": "Say these things and exhort and reprove with all authority. Let no one despise you."
    }
  },
  {
    "book": "TIT",
    "chapter": 3,
    "verse": 1,
    "content": {
      "paragraph": true,
      "text": "Remind them to be in subjection to rulers and to authorities, to be obedient, to be ready for every good work,"
    }
  },
  {
    "book": "TIT",
    "chapter": 3,
    "verse": 2,
    "content": "to speak evil of no one, not to be contentious, to be gentle, showing all humility toward all men."
  },
  {
    "book": "TIT",
    "chapter": 3,
    "verse": 3,
    "content": "For we were also once foolish, disobedient, deceived, serving various lusts and pleasures, living in malice and envy, hateful, and hating one another."
  },
  {
    "book": "TIT",
    "chapter": 3,
    "verse": 4,
    "content": "But when the kindness of God our Savior and his love toward mankind appeared,"
  },
  {
    "book": "TIT",
    "chapter": 3,
    "verse": 5,
    "content": "not by works of righteousness which we did ourselves, but according to his mercy, he saved us through the washing of regeneration and renewing by the Holy Spirit,"
  },
  {
    "book": "TIT",
    "chapter": 3,
    "verse": 6,
    "content": "whom he poured out on us richly through Jesus Christ our Savior;"
  },
  {
    "book": "TIT",
    "chapter": 3,
    "verse": 7,
    "content": "that being justified by his grace, we might be made heirs according to the hope of eternal life."
  },
  {
    "book": "TIT",
    "chapter": 3,
    "verse": 8,
    "content": "This saying is faithful, and concerning these things I desire that you insist confidently, so that those who have believed God may be careful to maintain good works. These things are good and profitable to men;"
  },
  {
    "book": "TIT",
    "chapter": 3,
    "verse": 9,
    "content": "but shun foolish questionings, genealogies, strife, and disputes about the law; for they are unprofitable and vain."
  },
  {
    "book": "TIT",
    "chapter": 3,
    "verse": 10,
    "content": "Avoid a factious man after a first and second warning,"
  },
  {
    "book": "TIT",
    "chapter": 3,
    "verse": 11,
    "content": "knowing that such a one is perverted and sinful, being self-condemned."
  },
  {
    "book": "TIT",
    "chapter": 3,
    "verse": 12,
    "content": {
      "paragraph": true,
      "text": "When I send Artemas to you, or Tychicus, be diligent to come to me to Nicopolis, for I have determined to winter there."
    }
  },
  {
    "book": "TIT",
    "chapter": 3,
    "verse": 13,
    "content": "Send Zenas the lawyer and Apollos on their journey speedily, that nothing may be lacking for them."
  },
  {
    "book": "TIT",
    "chapter": 3,
    "verse": 14,
    "content": "Let our people also learn to maintain good works to meet necessary needs, that they may not be unfruitful."
  },
  {
    "book": "TIT",
    "chapter": 3,
    "verse": 15,
    "content": [
      {
        "paragraph": true,
        "text": "All who are with me greet you. Greet those who love us in faith."
      },
      { "paragraph": true, "text": "Grace be with you all. Amen." }
    ]
  }
]
